{
  "campaign_elapsed_seconds": 10298.35660123825,
  "cases": [
    {
      "authorship": "public author identified; assistance unverified",
      "base": "bad49b7819853023d8f6a7181951108750d14ae0",
      "base_bytes": 20972218,
      "base_files": 1582,
      "comparison": {
        "control_upstream": {
          "reason": "hard gates",
          "verdict": "upstream"
        },
        "develop_control": {
          "reason": "hard gates",
          "verdict": "develop"
        },
        "develop_upstream": {
          "order_sensitive": true,
          "reason": "blinded rubric",
          "score_delta": -5.0,
          "verdict": "upstream",
          "votes": [
            "develop",
            "upstream",
            "upstream"
          ]
        },
        "diff_85": {
          "control_upstream": {
            "delta": -30.0,
            "reversal": false
          },
          "develop_control": {
            "delta": 21.25,
            "reversal": false
          },
          "develop_upstream": {
            "delta": -8.75,
            "reversal": false
          }
        }
      },
      "complexity": null,
      "controls": {
        "arm_order": [
          "control",
          "develop"
        ],
        "build": "/deps/lib/cmake/data/bin/cmake -S . -B build-panel -DENABLE_TEST=ON -DENABLE_CPIO=OFF -DENABLE_CAT=OFF && /deps/lib/cmake/data/bin/cmake --build build-panel -j2 --target bsdtar libarchive_test",
        "cpu_pair": [
          0,
          1
        ],
        "deadline_seconds": 14040,
        "dependencies_sha256": "f3fac19cb045d9f788cb39476f3efe604630a792d3658720c3b176c63322a870",
        "fixture_sha256": "d8ad89adbfec3459da1063c9da2c84e74fbf224e4920f839038f019e9be682c0",
        "grader_native": "./build-panel/bin/libarchive_test test_read_data_large test_read_data_into_fd_sparse",
        "independent_check": false,
        "merged_patch_sha256": "bc070b611217b0e21de63df6c22a1fce52a5dc131113a3722f064e2c129765c0",
        "prompt_sha256": "d8f75ba3b38d2fff0a98b0cbb6d3d6a8bc9173f5b335c2e8a54e53ba359a4b13",
        "worker_native": "./build-panel/bin/libarchive_test test_read_data_large test_read_data_into_fd_sparse",
        "workers": {
          "toolchain": "sha256:67880b3941e3604e6bbf9ab36982f4bf78ba6a9e5206c44c9330da11db4b03a9",
          "worker": "sha256:0cbce7c1793c4c29d1dc45ae47c72ee7b0f9c21a4c8901d6c24af2447e2cc0b3"
        }
      },
      "domain": "archive reader and CLI",
      "first_commit": "2026-10-21T17:32:12Z",
      "id": "libarchive",
      "judge_attempts": [
        {
          "accepted": true,
          "attempt": 0,
          "coverage": "complete",
          "limitations": [
            "Only the supplied frozen exits are execution evidence; no candidate was executed or edited. The selected native scope is test_read_data_large and test_read_data_into_fd_sparse, not the entire suite or all newly added tests.",
            "Contract and preserve checks have successful exits but no supplied commands, case inventories or detailed logs. No additional execution coverage, sanitizer run, diff check or non-Linux run is inferred from proposal claims.",
            "Native Windows findings are source-level deductions from the supplied patches and starting platform shims, not observed Windows executions. Existing Windows WriteFile append limitations are distinguished from introduced regressions.",
            "Eligibility timing, patch application logs and historical verification details are unavailable; no authorship or identity inference was used."
          ],
          "native_sha256": "40dff78c90de2d530ad09b61307327af7f85457c8d8b7c97b5f03ba5b0560788",
          "rotation": 0,
          "state": "completed",
          "threads": 1,
          "tokens": {
            "cacheWriteInputTokens": 0,
            "cachedInputTokens": 367488,
            "inputTokens": 403812,
            "outputTokens": 3183,
            "reasoningOutputTokens": 690,
            "totalTokens": 406995
          },
          "usd_estimate": 0.14122679999999999,
          "wall_seconds": 126.24111139494926
        },
        {
          "accepted": true,
          "attempt": 0,
          "coverage": "complete",
          "limitations": [
            "Only the frozen exit codes in packet/task.json are available as execution evidence. No candidate was executed, applied or edited. No agents or external sources were used.",
            "The supplied build targets bsdtar and libarchive_test; the native command selects test_read_data_large and test_read_data_into_fd_sparse. Detailed contract/preserve commands, assertions, baseline mismatches, skip counts and logs are unavailable, so their exit 0 results cannot establish broader or historical verification claims.",
            "All three proposal texts are observed as present and were scored separately from implementation. No absent or interrupted proposal text required a null score. Release timing and patch replay eligibility were not independently established.",
            "Platform findings are based on the supplied patches and starting Windows wrappers, not additional runtime observations. Removal of C's final position check was inspected explicitly; no unsupported integrity allegation or speculative security bypass is asserted."
          ],
          "native_sha256": "4ed33c810c8580b83ca6c336b2093c4378acefcd2d882f86de34126b48b74198",
          "rotation": 1,
          "state": "completed",
          "threads": 1,
          "tokens": {
            "cacheWriteInputTokens": 0,
            "cachedInputTokens": 339328,
            "inputTokens": 374469,
            "outputTokens": 3078,
            "reasoningOutputTokens": 688,
            "totalTokens": 377547
          },
          "usd_estimate": 0.1349948,
          "wall_seconds": 113.91856555803679
        },
        {
          "accepted": true,
          "attempt": 0,
          "coverage": "complete",
          "limitations": [
            "Assessment uses only packet artifacts and static inspection of starting source; no candidate was executed, applied or edited.",
            "Frozen execution evidence consists of exit summaries only. The specified native slice is test_read_data_large and test_read_data_into_fd_sparse; detailed contract/preserve cases, logs, skips, sanitizer runs, CLI-test execution and cross-platform runs are unavailable.",
            "B final-offset-check removal was inspected explicitly. Declared-size and write-error protections remain; no concrete material bypass or critical regression is demonstrated by the available evidence. Windows test incompatibilities are static findings, not observed Windows executions.",
            "Eligibility timing, patch-application logs and historical verification transcripts are unavailable; no identity or authorship information was used."
          ],
          "native_sha256": "b68165c248ee55f4ad20386fa9d8aff2bb21f309f733dc5f8df62b30920fb80f",
          "rotation": 2,
          "state": "completed",
          "threads": 1,
          "tokens": {
            "cacheWriteInputTokens": 0,
            "cachedInputTokens": 260736,
            "inputTokens": 305898,
            "outputTokens": 2860,
            "reasoningOutputTokens": 642,
            "totalTokens": 308758
          },
          "usd_estimate": 0.1449976,
          "wall_seconds": 103.76881620800123
        }
      ],
      "language": "C",
      "merged": "7bf74d481dbfdf72b90f3dab949c1eedb09c6dd0",
      "pr": 3737,
      "pr_delta": [
        2,
        117,
        2
      ],
      "pr_open_to_merge_seconds": 524745.0,
      "prompt": "Fix extracting archive data to a nonempty file opened with O_APPEND. Appending entries through bsdtar -xO must preserve the prefix and append all entries without a spurious seek failure. Keep ordinary extraction, pipe output and sparse file handling working. Add a regression.",
      "repo": "libarchive/libarchive",
      "split": "confirmation",
      "stratum": "external"
    },
    {
      "authorship": "public author identified; assistance unverified",
      "base": "3a11ad148397b7628256f5e5d76a454213480c63",
      "base_bytes": 1375318,
      "base_files": 595,
      "comparison": {
        "control_upstream": {
          "reason": "hard gates",
          "verdict": "both failed"
        },
        "develop_control": {
          "reason": "hard gates",
          "verdict": "both failed"
        },
        "develop_upstream": {
          "reason": "hard gates",
          "verdict": "both failed"
        },
        "diff_85": {
          "control_upstream": {
            "delta": 6.25,
            "reversal": false
          },
          "develop_control": {
            "delta": 0.0,
            "reversal": false
          },
          "develop_upstream": {
            "delta": 6.25,
            "reversal": false
          }
        }
      },
      "complexity": "TypeScript Markdown parser, interacting delimiter rules",
      "controls": {
        "arm_order": [
          "develop",
          "control"
        ],
        "build": "npm run build:esbuild && ./node_modules/.bin/tsc --noEmit",
        "cpu_pair": [
          0,
          1
        ],
        "deadline_seconds": 1200,
        "dependencies_sha256": "f08bb6c6875287e2d561d736c4c33a97bb90f22aadf6e9d6260267795495296b",
        "fixture_sha256": "9d50ede802144f9a4031c62139d5a2a2565ed4331de08d6f158b5c28cdd45d57",
        "grader_native": "npm run test:specs",
        "independent_check": true,
        "merged_patch_sha256": "3affc55aebbd9f2345b890cb9f6dc40a6fdb024bc4674e697ffaaf37d49dcd6a",
        "prompt_sha256": "6ce320c1f43703add9787cbe9e32867d750eaa5c2d845b00125ee798bc2f30ba",
        "worker_native": "node --test --test-skip-pattern='^quadratic_' --test-reporter=spec test/run-spec-tests.js",
        "workers": {
          "toolchain": "sha256:de636e50060a9908cf40a20a50d027ed74a99b2e31d2635f3b13e9e4e5e97e74",